<!ELEMENT products (product+)>
<!ELEMENT product (producer,model,date-of-issue,color,(not-in-stock|price))>
<!ELEMENT producer (#PCDATA)>
<!ELEMENT model (#PCDATA)>
<!ELEMENT date-of-issue (#PCDATA)>
<!ELEMENT color (#PCDATA)>
<!ELEMENT price (#PCDATA)>
<!ELEMENT not-in-stock EMPTY>
